在直实生产环境中，一般不会对数据做物理删除，而是用字段来标记为逻辑删除，将对应字段值设为某
个特定项(is_del )，(is_del=1)认为是己删除
清空表
 
3.7 DQL 语句
 
格式
| 14 | test1    |   30 | F      |      1 |
| 15 | test2    |   21 | M      |      1 |
| 16 | test3    |   31 | F      |      1 |
| 17 | NULL     |   23 | F      |      0 |
| 18 | xiaohong |   31 | F      |      1 |
| 19 | xiaohong |   31 | F      |      1 |
| 20 | zhangsan |   31 | F      |      1 |
+----+----------+------+--------+--------+
10 rows in set (0.00 sec)
mysql> UPDATE stu SET is_del=1 WHERE id=11;
Query OK, 0 rows affected (0.00 sec)
Rows matched: 1  Changed: 0  Warnings: 0
mysql> select * from stu;
+----+----------+------+--------+--------+
| id | name     | age  | gender | is_del |
+----+----------+------+--------+--------+
| 11 | xiaohong |   30 | F      |      1 |
| 12 | zhangsan |   30 | F      |      0 |
| 13 | xiaozhou |   30 | F      |      1 |
| 14 | test1    |   30 | F      |      1 |
| 15 | test2    |   21 | M      |      1 |
| 16 | test3    |   31 | F      |      1 |
| 17 | NULL     |   23 | F      |      0 |
| 18 | xiaohong |   31 | F      |      1 |
| 19 | xiaohong |   31 | F      |      1 |
| 20 | zhangsan |   31 | F      |      1 |
+----+----------+------+--------+--------+
10 rows in set (0.00 sec)
TRUNCATE TABLE tbl_name;   #DDL语句，不支持事务，效率更高
DELETE FROM tbl_name;      #DML语句
mysql> help select
Name: 'SELECT'
Description:
Syntax:
SELECT
    [ALL | DISTINCT | DISTINCTROW ]
    [HIGH_PRIORITY]
    [STRAIGHT_JOIN]
    [SQL_SMALL_RESULT] [SQL_BIG_RESULT] [SQL_BUFFER_RESULT]
