删除表内容
+----+-----------+-------+-----------+-------+
4 rows in set (0.00 sec)
mysql> update info set address='巴黎' where name='曹操';
Query OK, 1 row affected (0.01 sec)
Rows matched: 1  Changed: 1  Warnings: 0
mysql>  select * from info;
+----+-----------+-------+-----------+-------+
| id | name      | score | address   | hobby |
+----+-----------+-------+-----------+-------+
|  1 | 唐三      | 90.00 | 广州      |     1 |
|  2 | 叶凡      | 91.00 | 伦敦      |     2 |
|  3 | 喜羊羊    | 92.00 | 华盛顿    |     3 |
|  4 | 曹操      | 93.00 | 巴黎      |     4 |
+----+-----------+-------+-----------+-------+
4 rows in set (0.00 sec)
mysql> update info set score=66.5,address='合肥' where id=4;
Query OK, 1 row affected (0.00 sec)
Rows matched: 1  Changed: 1  Warnings: 0
mysql> select * from info;
+----+-----------+-------+-----------+-------+
| id | name      | score | address   | hobby |
+----+-----------+-------+-----------+-------+
|  1 | 唐三      | 90.00 | 广州      |     1 |
|  2 | 叶凡      | 91.00 | 伦敦      |     2 |
|  3 | 喜羊羊    | 92.00 | 华盛顿    |     3 |
|  4 | 曹操      | 66.50 | 合肥      |     4 |
+----+-----------+-------+-----------+-------+
4 rows in set (0.00 sec)
mysql> select * from info where name='喜羊羊' ;
+----+------+-------+-----------+-------+
| id | name | score | address   | hobby |
+----+------+-------+-----------+-------+
|  3 | 喜羊羊  | 92.00 | 华盛顿    |     3 |
+----+------+-------+-----------+-------+
1 row in set (0.00 sec)
mysql> select * from info;
+----+-----------+-------+-----------+-------+
| id | name      | score | address   | hobby |
+----+-----------+-------+-----------+-------+
|  1 | 唐三      | 90.00 | 广州      |     1 |
|  2 | 叶凡      | 91.00 | 伦敦      |     2 |
|  3 | 喜羊羊    | 92.00 | 华盛顿    |     3 |
|  4 | 曹操      | 66.50 | 合肥      |     4 |
+----+-----------+-------+-----------+-------+
4 rows in set (0.00 sec)
